{"entries":[{"path":"appss/2of3/SB01.json","sha256":"56de8ab6b5982072377ca7c5e7135e23640e1cdae49f5c68e9e689a715dc6c73","size":3887},{"path":"appss/2of3/SB02.json","sha256":"60b324452657aa59ed49050ddf487ef12ce41990050fbd406cfa0c240e021a01","size":3869},{"path":"appss/2of3/SB03.json","sha256":"018f4862bc2ad2607c44a72235424ed462a239ccc5aa2e3673c7ce8a3805720d","size":3869},{"path":"appss/2of3/SB04.json","sha256":"30c9fecf1edfee3061211a00e6423ed68591e8657e0c7780f0fb4ee8b7a8adab","size":3873},{"path":"appss/2of3/SB05.json","sha256":"27ad480744014d1d795d69d62e1e88140b494a61216e4a95ce62595c4c8ce90c","size":3861},{"path":"appss/2of3/SB06.json","sha256":"aeec929959faccc1c91ab97187f9b0ae0f18f4a26beaed851c2e809067042cde","size":3879},{"path":"appss/2of3/SB07.json","sha256":"2f3d92c8c946b2b0ae5f6464f70f617fc2ae90b5fc1e476a1af67a8ad7f7a7f0","size":3869},{"path":"appss/2of3/SB09.json","sha256":"9b1c2ec6348fa64527e7471b4cd319e90307b6be28036947682a99a49b9b3c4b","size":3873},{"path":"appss/2of3/SB14.json","sha256":"11391eb262256468c2294d0d6d2c9cc51c5a9c21bf405e9d992f3dfc5ecccb59","size":3916},{"path":"appss/3of5/SB01.json","sha256":"ff70cbf5f8c492b87b5fb3a30257abbdfbe8d4bb37d57be3154694758e6086f9","size":3891},{"path":"appss/3of5/SB02.json","sha256":"0de9f04a2625721b32164ec41d8c79ccb12cbf26de8a9d5c0b2ef8f08674a0e3","size":3876},{"path":"appss/3of5/SB03.json","sha256":"8285f80f435df5bae6015bf7f40b4f5a50705a95bb8451385b3469c46839a9ef","size":3876},{"path":"appss/3of5/SB04.json","sha256":"226dbfbd8737d27f7426f7f998fe26e6b56d320041c20609f517e317ac80d4e9","size":3880},{"path":"appss/3of5/SB05.json","sha256":"a250ee86b65984dde4cc0f4a8c2adba54c2a02446f799e4c55976d71ed3c2342","size":3865},{"path":"appss/3of5/SB06.json","sha256":"c42e75c8a1d8bc95bcf1f12f32b34fe265f3870acb99dd67a058eb8303480128","size":3883},{"path":"appss/3of5/SB07.json","sha256":"6c82408b6d478d711997e0c70659bfc572a6f1eef78bf7cc8259631727f1d984","size":3873},{"path":"appss/3of5/SB09.json","sha256":"1d5918a66ee34cf3bbaf88eafab33aa0acc21defc5da9d8ff72a420c9d705157","size":3877},{"path":"appss/3of5/SB14.json","sha256":"28f30ee4be840d490ad1075b01321220f272186e9bf752fd639e27518908c555","size":3920},{"path":"common/2of3-paired/SB08.json","sha256":"643649a1a58485c9b0973cc61d46da4cd8bcb131cde125da0c01d78ac003f199","size":3595},{"path":"common/3of5-paired/SB08.json","sha256":"c548c200bfc95a530a4874b03341d3ef78d2543e63e7407095753d1395a380bf","size":3595},{"path":"common/managed-common/SB10.json","sha256":"5b8e8c8f9555ee3faa606243be535c97eaac75e71635428051a35a3aed941f47","size":3604},{"path":"common/managed-common/SB11.json","sha256":"d6f1d6f8e7d922a75ecf60587e98c45de9a60d051bf1018e71325a2fbe8069f4","size":3604},{"path":"common/managed-common/SB12.json","sha256":"4726590d9e47d7a2b7fc56eadf14142f59d49f7a9ce314b54c436fb72db1e562","size":3594},{"path":"common/managed-common/SB13.json","sha256":"90c04472cfbf91c8b6633859abf0159c236b86d2d2422483bf535251273ad1bb","size":3589},{"path":"yi/2of3/SB01.json","sha256":"0c14253bc719999c59d813e53447e41bc18b256952810240b33fc965a93e542a","size":3860},{"path":"yi/2of3/SB02.json","sha256":"0af811bb1a1cfc2bd5a938c97ec2ca1bbd4c247e93b0fda7b318bc1c52d824b8","size":3842},{"path":"yi/2of3/SB03.json","sha256":"c8273a7442e658b9114998a1a289962707f1f6e40bb9cc7676aad3c917ab2f62","size":3842},{"path":"yi/2of3/SB04.json","sha256":"113a22f0c67d060206979b356f50628ef9e16fa7dc209891954ff6523a853ccc","size":3846},{"path":"yi/2of3/SB05.json","sha256":"082b200ba63a8eadc51d55f5bbd8cc1c637bcf041d8bedfd5a9bee851ca75426","size":3834},{"path":"yi/2of3/SB06.json","sha256":"94befe4556a25a0a1ed8637d5081654b13535032ba168bb325b1eac03d62d607","size":3852},{"path":"yi/2of3/SB07.json","sha256":"42fbaef8967cb5459e2706d52e09ffcea9ade6711384976fcd0054f37e09730f","size":3842},{"path":"yi/2of3/SB09.json","sha256":"b5ea6d78f80c431f0fc3ecd2173c0a726a675bae86a1ee09bc501ea7b5b1155c","size":3846},{"path":"yi/2of3/SB14.json","sha256":"2b24141c7e389d2ccd10526b0fbace444dcf49a34b976e089786abed2a0a224d","size":3889},{"path":"yi/3of5/SB01.json","sha256":"65b33611d407feb3262cc2ef72a50d8a38046e6734e97a9f8b1c05963d74cd0c","size":3864},{"path":"yi/3of5/SB02.json","sha256":"95e7428d93bcaba4c39e7324a795e63197bb354a58a30eaa8eaa4054a4a7e91f","size":3849},{"path":"yi/3of5/SB03.json","sha256":"1b2ef7016a5cd430df0648cdab58db87ecb1a93f1def575b74f6842ac5edc910","size":3849},{"path":"yi/3of5/SB04.json","sha256":"0bc870993003c11010caa7147a19a29b3cf966e90ec639f311bb5eee74b1730a","size":3853},{"path":"yi/3of5/SB05.json","sha256":"4389854f1721f06a4641dcc452c7d576c2ba676d1f8d9339458a2fe09eb2f5c4","size":3838},{"path":"yi/3of5/SB06.json","sha256":"a2c1d0f6fcdbf4d5cd2ef6ac63292dbb47afd98acafa952100e846dbced8b716","size":3856},{"path":"yi/3of5/SB07.json","sha256":"feabdeb597e2ff8c04e213548e4114ef5cf2627c9db1f73688ca6c04935c6cf5","size":3846},{"path":"yi/3of5/SB09.json","sha256":"f53993f0a24f9cc697ba727300757d2777688c00116fd25b5247b82acc57434e","size":3850},{"path":"yi/3of5/SB14.json","sha256":"575397f2686f6c53967c1e81c2ae7a767c04ba6f25f61c3d692597a5112b1263","size":3893}],"format_id":"LOCUS-managed-state-corpus-manifest-v1","record_count":42,"records_sha256":"e31b215c936ed6693ac84e2bcf2d497a986e6e7cfaf0445637a749836aab83d5","scenario_manifest_sha256":"8c334a171de4cf36e2ff4087a5c6a3ee74c10980b8bd5c259621ccb8f226d1a6","status":"complete"}
